,filename,ID,Result,AA_Rationale,AA_Factor,AD_Rationale,AD_Factor,RA_Rationale,RA_Factor,RD_Rationale,RD_Factor
34,"201503/臺灣新北地方法院民事/PCDV,103,家親聲,632,20150325,1.json",29_28_11be7b,c,扶養案主之態度積極，現階段確實提供案主正常、穩定的生活，聲請人及其再婚先生有實際照顧案主生活起居及陪伴學習、成長，並能有耐性的給予案主要求及教導，又訪談中觀察案主對聲請人及其再婚先生之住所熟悉，能自在活動，案主與聲請人、聲請人再婚先生及其家人間均有肢體接觸，互動頻繁；承諾日後會持續親自照顧及打理案主生活，並陪伴學習與成長，給予親情關愛與呵護，已安排案主接受學齡前教育，亦陪同參加讀經班等課程，另聲請人再婚先生將會全力支援聲請人；有讓案主接受基本教育，並提供妥適之生活照料，且有再婚先生之支持與協助，故聲請人之照顧計晝應可符合案主各階段之需求與發展。案主陳述聲請人及其再婚先生有照顧他，也有陪他玩耍，又訪談時觀察案主與聲請人等家人之互動頻繁緊密，相處氣氛融洽自在，尤其與聲請人再婚先生間有擁抱、親吻之舉動，且堅持要聲請人再婚先生陪同玩耍；案主正常接受學齡前教育、作息正常，在生活及情感上對聲請人等家人是屬倚賴，故應可由聲請人承擔監護職責。全職照顧案弟，目前聲請人、案主之所有生活開銷、案主教育費等皆由聲請人再婚先生支應，而聲請人再婚先生經濟狀況尚佳，聲請人有其再婚先生支持應可持續承擔案主之扶養，對案主之保護與教養無失職之處，且有心承擔親職，故案主由聲請人單方監護扶養，應無不妥等情，聲請人之現任配偶楊騏菖對葉欲民視如己出，彼此間感情良好、關係緊密。葉欲民自出生迄今均由聲請人擔任主要照顧者，彼此間已建立緊密的依附關係，葉欲民亦習慣目前之生活環境及照顧方式，,"親子感情,支持系統,父母經濟,子女意願,意願能力,主要照顧",,,會與被監護人溝通合宜的行為舉止為何，被監護人亦能接受管教與設限，願意陪伴、栽培被監護人持續就學與成長，具有良好教養能力。工作穩定且也有儲蓄習慣，經濟能力尚可，能提供本身及被監護人生活所需。相對人父母身心健全、慈祥和藹，鄰里關係良好，對被監護人充滿愛意與溫暖，且相對人兩位碩士學歷姊姊，以及從事教育工作的姊夫亦會給予相對人諮詢與建議，評估相對人非正武支持系統穩定。曾因賭博經法院判處徒刑，及對聲請人施以家庭暴力，本院認聲請人於101年間因犯賭博罪經法院判處徒刑後，迄今並無刑事案件犯罪紀錄，亦無再對聲請人及家屬施以暴力之情，顯見相對人已深自反省，並導正其行為及生活，自不應因此剝奪相對人擔任葉欲民親權人之機會葉欲民於本院表示伊喜歡跟丙○○爸爸或楊騏菖爸爸睡覺，也喜歡跟丙○○爸爸或楊騏菖爸爸玩，伊喜歡跟丙○○爸爸或楊騏菖爸爸一起住等語，足徵相對人與兩造互動良好、感情親密，,"親子感情,父母生活,支持系統,父母經濟,子女意願,父母品行,意願能力",於兩造婚姻關係存續中曾對聲請人施以家庭暴力，,"親子感情,父母品行,父母生活"
35,"201502/臺灣臺中地方法院民事/TCDV,103,家親聲,686,20150206,1.json",20_34_a92cc3,b,身心狀況良好，且有運動習慣，在經濟上，反請求相對人為國小教師，工作收入及時間穩定，自述收入部份能支付生活開銷，在支持系統上，目前與父母親、大哥同住，而姊姊偶爾會返家，會利用手機通訊軟體保持聯絡，評估反請求相對人具有監護能力惟就反請求相對人未來生活計畫，評估反請求相對人未來之親職時間及親職能力能符合案主所需目前居住格局為透天厝，在反請求相對人之父母親名下，室內擺飾簡單，距離幼兒園為五至八分鐘，距離附近之診所為八分鐘，距離超市、百貨公司為六至十分鐘，且附近也有公園，故生活機能便利，評估反請求相對人所提供之照護環境適合案主成長及居住。而認為自己照顧案主認真仔細，對案主未來發展較好，另外，未來不會阻止反請求聲請人探視案主，評估反請求相對人有意爭取案主監護權，且對於反請求聲請人探視態度友善教育計畫應可行，且依反請求相對人之經濟狀況，應能支付案主之教育費用,"父母生活,親子感情,支持系統,父母經濟,父母健康,意願能力,父母職業,友善父母",對反請求相對人的人格、責任感、情緒控管及支持系統皆不信任，尤其對反請求相對人曾經對她及案主有肢體傷害一事有所反感，反請求聲請人更無法接受反請求相對人過去會當著案主面前言語表達「nomummy」等語，無法茍同反請求相對人挑撥她與案主間的母子情感針對反請求相對人，案主未有特別的描述，案主僅有說明很久沒有與反請求相對人相處或說話自一百零一年四月開始，反請求聲請人便會限制反請求相對人僅能在住家探視，於一百零一年，反請求相對人僅順利探視三次，而於一百零二年，僅在八月探視一次，因反請求相對人探視時間短少，致使反請求相對人對於案主的生活狀況皆不甚了解就反請求相對人探視案主之次數及時間，認為反請求相對人目前親職時間明顯不足，使反請求相對人親職能力無法展現，雖反請求相對人對未來有所規劃，然案主恐將面臨照顧者及環境之轉變,"親子感情,意願能力,支持系統,友善父母",具備監護案主之意願且態度及行動力積極為正式教師，工作及薪水穩定，且反請求聲請人與案外祖父母同住，家庭開銷大多是有案外祖父母協助支付，減輕反請求聲請人的經濟負擔，讓反請求聲請人有更多金錢可運用在案主教育及生活支出上與案主的親子關係良好，有建立穩定的親情依附依據案主所述之日常生活中的陪伴者及照顧者，為反請求聲請人及案外祖父母，他們也都是最疼愛案主之人，案主可以明確分享反請求聲請人對他生活照料的內容，且對與反請求聲請人同住的生活表達沒有感到不好的地方，案主對反請求聲請人並未有討厭或不喜歡的地方評估反請求聲請人較有參與案主生活成長之經驗，案主也清楚反請求聲請人有真的付出對他的照顧,"親子感情,支持系統,父母經濟,意願能力,父母職業",工作地點為新北金山，並無與在板橋的案主同住，案主皆由案外祖父母照顧，雖於一百零三年反請求聲請人請調回板橋，然其父母親較為寵愛，將不利於案主人格的發展,"親子感情,支持系統,父母生活,父母職業"
36,"201610/臺灣雲林地方法院民事/ULDV,105,家親聲,86,20161031,1.json",10_31_885202,c,評估聲請人支持系統及親職功能部分皆屬良好，可提供未成年子女穩定、妥善之生活照顧，且監護動機亦屬良善，評估未成年子女由聲請人監護應無不妥之處等語兩造對於未成年子女的關愛，於會談過程中可以觀察到兩造與未成年子女之間皆具依附關係親職能力較為完整，且其較能回應未成年子女現階段的語言與認知能力的發展需求，可以從其回應未成年子女的方式理解未成年子女的問題與日常照顧能力得知。認兩造在經濟狀況、親職能力、支持系統及照顧計畫等方面，均具有照護上開未成年子女之能力，且皆有強烈之監護意願，更對上開未成年子女之成長表現出相當之關心與疼愛之情。聲請人較相對人了解上開未成年子女之生活情況、喜好及習性，併參酌母親之角色有其獨特之女性人格特質，最能了解小孩在生活上之需要，母親亦往往較能照顧小孩的生活起居，此尤以年幼子女更甚；,"子女年齡,親子感情,支持系統,父母經濟,意願能力",,,故相對人的支持系統足夠尚穩定兩造對於未成年子女的關愛，於會談過程中可以觀察到兩造與未成年子女之間皆具依附關係對於上開未成年子女之關心與疼愛則無二致○本院參酌上揭訪視報告、調查報告、兩造之陳述及所提事證，認兩造在經濟狀況、親職能力、支持系統及照顧計畫等方面，均具有照護上開未成年子女之能力，且皆有強烈之監護意願，更對上開未成年子女之成長表現出相當之關心與疼愛之情。認兩造在經濟狀況、親職能力、支持系統及照顧計畫等方面，均具有照護上開未成年子女之能力，且皆有強烈之監護意願，更對上開未成年子女之成長表現出相當之關心與疼愛之情。,"親子感情,意願能力,支持系統,父母經濟",評估其育嬰知識及技巧尚待加強，且需有育嬰經驗的家人或長輩從旁指導及協助，教養計畫部分，相對人則囿於工作之關係，需委由保母照顧依此足認相對人因工作之故，顯無法隨時親自陪伴照顧未成年子女，而父親若要取代母親的功能角色，即便花極大功夫與時間，亦恐難扮演好母親之角色，,"親子感情,意願能力,父母職業"
37,"201502/臺灣嘉義地方法院民事/CYDV,104,家親聲,3,20150226,1.json",11_14_eeea6c,b,有穩定工作及收入來源，可提供本身與甲、乙基本生活所需；家庭成員間感情深厚，家庭成員願意協助照顧兩名未成年子女，甲與聲請人家庭成員互動狀況良好甲一出生迄今多半由聲請人擔任主要照顧者，聲請人對於甲、乙身心狀況瞭解；具有高度監護意願，期待能單獨監護甲、乙，並願負擔甲、乙未來養育責任，在居住環境、學歷、親屬支援系統、經濟狀況、照顧未成年子女之經驗及技巧與子女間之情感依附關係等項，兩造所具備之條件與能力相當，亦均無對於未成年子女不利之處,"親子感情,父母生活,支持系統,父母經濟,意願能力,主要照顧",名下除機車一部外，無任何動產及不動產乙則多由相對人父母協助照顧，_SpecificCase_及所附工作摘要紀錄表、訪視建議表在卷可參。不願意照顧未成年子女，常返回淡水娘家住處，97年返回東石居住時，聲請人在家中只是將子女丟給相對人母親照顧，有時回淡水就不願回來照顧家庭，自幼即與相對人及其親屬同住、照顧，乙在社工員訪視及本院調查時，前後一致表明不願與聲請人同住甲於雙福訪視時，固表示希望與聲請人同住，然其於本院2次調查時詢問其意願，一致表示希望與相對人同住,"親子感情,父母生活,支持系統,父母經濟,子女意願,意願能力",在居住環境、學歷、親屬支援系統、經濟狀況、照顧未成年子女之經驗及技巧與子女間之情感依附關係等項，兩造所具備之條件與能力相當，亦均無對於未成年子女不利之處對於相對人住處生活環境、親屬互動、同儕師長學習模式已然熟悉並適應乙對於出生至今之家庭環境、生活模式、周遭接觸親屬具有熟悉及安全感，其既無意願變動相對人及其家屬對乙之照顧保護並無任何不利或疏失，,"親子感情,父母生活,支持系統,父母經濟,子女意願,意願能力",,
39,"201611/臺灣高等法院花蓮分院民事/HLHV,104,家上,12,20161103,2.json",48_25_fde1d6,b,希望由其單獨監護未成年人，或由兩造共同監護。,"親子感情,友善父母",查本件許博翔為家庭暴力之加害人，其屢對家庭成員即林淑芳、兩造未成年子女許○○為家庭暴力行為，業經本院調查認定如前，故本件對於未成年子女許○○權利義務之行使或負擔，應推定許博翔不適任評估許博翔目前難稱合適之主要照顧者等語，參以許博翔有前述家庭暴力之情形，恐對未成年子女許○○身心發展造成負面影響，未成年子女許○○亦對情緒管控較差之許博翔感到恐懼，與許博翔關係緊張、疏離，,"親子感情,父母生活,父母品行,意願能力,人格發展",未成年人自出生迄今，大都是由林淑芳主責照顧，安排未成年人之就學及生活作息，負擔未成年人之各項費用，林淑芳爭取未成年人權利義務行使或負擔之動機，積極而良善。林淑芳在各項指標表現良好，未成年人也期待由林淑芳照顧，參酌未成年人接受照顧之持續性、友善父母及未成年人之意願，應由林淑芳主責未成年人權利義務之行使或負擔較符合實際狀況本院審酌前揭事證暨上開訪視報告之結果及未成年子女許○○之意願，認林淑芳有監護未成年子女許○○之能力及意願，且向來擔任未成年子女許○○之主要照顧者，未成年子女許○○對照顧認知與情感依附者皆為林淑芳，，併考量兩造監護動機、意願及能力、家庭環境、未成年子女之年齡、意願、監護現狀等一切情狀，原審認未成年子女許○○之權利義務行使及負擔由林淑芳單獨任之，應符合子女之最佳利益，應為妥適。,"子女年齡,親子感情,父母生活,父母經濟,子女意願,意願能力,主要照顧,友善父母",,
43,"201602/臺灣士林地方法院民事/SLDV,104,婚,187,20160223,1.json",05_09_a6050c,b,住家室內約60多坪，客廳空間寬敞，以大片玻璃區隔客廳與辦公室，有兩間臥室，各自有衛浴，主臥室空間寬敞，合併浴室約大20坪大，內設置雙人床與簡單傢具，另一臥房目前多堆置雜物，並無床舖，案主來時與聲請人同睡。住家附近有天母商圈、大型公園、學區及大型醫院，育樂環境良好家人為主要非正式支持系統，過去曾請姐姐及母親到家中協助照顧案主，自述案主出生後扶養費均由其負擔，兩造分居後案主學費亦由其負擔了解案主性格與學習狀況，與案主互動正向良好,"親子感情,支持系統,父母生活",聲請人家人過去有協助照顧案主經驗，然觀察聲請人目前未與家人同住，與家人關係亦未顯親近，評估兩造均缺乏穩定支持系統聲請人過去有撫育案主經驗，然非案主生活主要照顧者惟兩造皆缺乏穩定支持系統，若由任一方單獨監護照顧案主，均有損案主最佳利益，故建議由兩造共同監護案主。,"主要照顧,親子感情,支持系統,父母生活",過去多為案主主要照顧者，了解案主身心發展與學習狀況，有實際教養及督促學習，與案主互動緊密，依附關係良好。未成年子女陳芝妤於訪視時已明確表達希望與母親同住，本院對其個人意願自應予尊重,"親子感情,子女意願,意願能力,人格發展,主要照顧",七月甫任職，工作狀況難稱穩定，難以評估其未來經濟穩定程度。生家庭成員均居住上海市，評估兩造均缺乏穩定支持系統,"支持系統,父母職業,父母經濟"
45,"201607/臺灣士林地方法院民事/SLDV,105,婚,58,20160719,1.json",14_49_b098a7,c,均具相當之經濟能力、親職能力、支援系統及監護意願，兩造均應具備獨立監護未成年子女之能力及意願。而未成年子女張睿辰自_SpecificDate_出生之時，兩造感情已屬不睦並分居，因此其自出生迄今均由原告獨自照顧是以未成年子女潘縉維亦應由原告負主要之照顧責任，並與母親即原告共同生活，較屬適當。,"主要照顧,意願能力,支持系統,父母經濟",,,具相當之經濟能力、親職能力、支援系統及監護意願，兩造均應具備獨立監護未成年子女之能力及意願。,"親子感情,意願能力,支持系統,父母經濟",未成年子女潘縉維雖由被告之母親照顧，惟此僅屬代替兩造照顧幼子之性質，而非可認定未成年子女潘縉維自幼即由被告單獨照顧扶養，且未成年子女潘縉維係於兩造衝突中，始被迫與原告分離而減少照顧期間，自不得因而認定係與被告共同生活且已產生緊密之親子依附關係，而認被告係較適合行使負擔其權義務之人自認其於婚姻關係中與訴外女子陳鈺婷交往等情，此亦為兩造婚姻破裂之重要原因，而被告目前仍與該女子交往中，因此未成年子女潘縉維若由被告單獨照顧扶養，是否會造成其心理上之影響，亦不無所疑,"親子感情,支持系統,人格發展"
47,"201611/臺灣屏東地方法院民事/PTDV,105,婚,135,20161129,1.json",24_10_5334a6,a,能理解並認同未成年人身心需求，可依照未成年人發展狀況來調整陪伴時間和關心重點，管教方式較傾向愛的教育，評估原告能提供有利未成年人正向發展之照顧向為未成年人之生活主要照顧者，孩子身心發展良好，照顧現況不宜貿然變動，原告亦有穩定經濟能力足以提供未成年人生活所需身體健康，體態與精神狀態皆良好，也有獨立照顧未成年人的經驗，亦有穩定工作及副業，且無負債，生活無虞，可認原告能提供未成年人實際生活上妥善之照顧。,"親子感情,父母經濟,父母健康,意願能力,人格發展,主要照顧",,,表示會給未成年人良好的照顧環境與品質，並表示不會阻擋被告探視未成年人，可認被告親權意願高，對於親權概念尚屬了解，又被告工作重心在北部，每週會抽出一、兩天時間回屏東陪伴未成年人，被告之母已退休，可穩定照顧陪伴未成年人被告與被告之母親職及教育規劃能力佳,"父母生活,意願能力,支持系統,友善父母",實際上並無照顧未成年子女之經驗，且其工作重心位於北部，只能依賴被告之母代為照顧，事實上難以親自照顧未成年子女婚後動輒毆打、辱罵原告，此據本院認定如前，是依法即推定由被告行使或負擔權利義務不利於未成年子女乙○○、甲○○。,"父母生活,父母品行,父母職業"
48,"201703/臺灣臺中地方法院民事/TCDV,105,家親聲,477,20170320,1.json",05_03_62919f,c,兩造目前均有爭取未成年子女江羿亭、江承宥親權之意願，工作時間能配合未成年子女江羿亭、江承宥之生活作息，家人亦可協助照顧未成年子女，評估兩造各項親權能力良好，均具有擔任親權人之能力綜觀全情及上開訪視及家事調查報告內容，可知兩造在教養能力上各有優劣，宜相互補足、分工合作並彼此監督，使二名子女能同時接受父母雙方之關懷，滿足子女各層面之需求。,"親子感情,父母生活,支持系統,意願能力,父母職業",多將照顧之責委由聲請人母親代為協助，涉入程度較低。兩名未成年子女在互動時，皆會不時以眼神觀看聲請人，在言行舉止上較顯約束，難以放鬆。,"親子感情,支持系統",兩造目前均有爭取未成年子女江羿亭、江承宥親權之意願，工作時間能配合未成年子女江羿亭、江承宥之生活作息，家人亦可協助照顧未成年子女，評估兩造各項親權能力良好，均具有擔任親權人之能力就兩造過往家庭角色之分工概況，相對人多屬擔任主要照顧者之角色，雖其目前照顧時間相對短暫，惟其仍花費時間及精力陪伴兩名未成年子女（如陪伴其等外出、協助洗澡等），並能回有效回應兩名未成年子女之心理及情感需求兩名未成年子女在與相對人及其家人相處時，有較多主動性的反應（如表達自身需求以及主動要求有擁抱等親密的舉動），臉部表情亦較豐富。綜觀全情及上開訪視及家事調查報告內容，可知兩造在教養能力上各有優劣，宜相互補足、分工合作並彼此監督，使二名子女能同時接受父母雙方之關懷，滿足子女各層面之需求。地方法院檢察署檢察官以_SpecificCase_起訴，此有起訴書在卷可參，惟查該案甫於_SpecificMonth_起訴，尚未經審理判決，則該案何時判刑確定、判決結果係有罪或無罪、若有罪者其刑期長短、是否獲緩刑宣告、何時執行等，均難以預測，自不得以該案否定相對人現階段之親職能力及擔任未成年子女主要照顧者之適切性,"親子感情,父母生活,支持系統,父母品行,意願能力,主要照顧",,
49,"201709/臺灣高等法院高雄分院民事/KSHV,106,家上,28,20170911,1.json",07_00_f71f82,b,目前有穩定之經濟來源，加上尚有家人可以提供經濟援助，分擔扶養之經濟壓力，其收入狀況足可滿足受監護人生活照顧需求，提供受監護人安定成長環境。與家庭成員間感情互動融洽，對於協助抗告人扶養受監護人均有照顧共識，家庭凝聚力屬佳，家人可適時補充生活需求、並協助分擔照顧壓力，評估抗告人支持系統穩固。在兩造分居前仍積極參與受監護人照顧工作，具有實際照顧經驗，評估抗告人具行使親權能力,"意願能力,支持系統,父母經濟",曾有家庭暴力行為，抗告人並未提出證據證明其較相對人適於行使未成年子女親權，依_LawArticles_規定意旨，由抗告人行使親權推定不利於未成年子女，故認對於兩造所生之未成年子女權利義務之行使或負擔，由相對人單獨任之，較符合子女之最佳利益。,"親子感情,父母生活",為目前受監護人主要照顧者，未來待育嬰假結束後，仍有妥善安排受監護人外祖母協助照顧，相對人具有正向教養觀念，可提供穩定照顧品質爭取單獨監護權，乃因抗告人確實仍有情緒狀況不佳，如生氣怒罵，致受監護人身心受到危害，且相對人也希望未來等抗告人情緒穩定，可在安全有第三人協助下，讓抗告人與受監護人會面交往，本會評估，相對人親權意願正向、積極。受監護人與相對人及相對人母親互動關係正向、依附關係緊密。兩造雖均適宜行使親權，然丙○○現僅_AgesYear_多，尚在哺乳階段，對母親照顧需求較高，出生至今主要亦由相對人及相對人母親照顧,"子女年齡,親子感情,父母生活,支持系統,意願能力,人格發展,主要照顧,友善父母",,
50,"201601/臺灣嘉義地方法院民事/CYDV,104,家親聲,63,20160113,1.json",06_49_75202d,a,就職業、經濟收入、對長男的生活照顧皆處於穩定狀態，對於長男的學習與未來發展，亦事先做評估與規畫的實際現況下，聲請人對長男的照顧與監護的意願是堅定且有能力的長男的發展、生活環境、人際應對、認知發展成熟度與儀態皆適宜，甚至還超越一般同齡孩子的表現，由此可看出聲請人及其家人對長男的照顧品質與所提供的學習成長環境是合宜且足夠的，聲請人家庭關係緊密且互動良好，對聲請人與長男的各項支持是充足且貼近的長男表明習慣住爸爸家，若去媽媽家住可能要轉學，其不希望跟現在的同學分開及轉學等語較清楚（相對人則不清楚）長男喜愛之運動、卡通，也有帶長男去公園打過棒球等情（見本院卷第74至75頁），就此過往行為紀錄，顯示較優於相對人，再佐以聲請人經濟來源穩定,"父母生活,親子感情,支持系統,父母經濟,子女意願,意願能力",,,母親主要為家管，且似曾為長男之主要照顧者多年，對長男之個性及生活細節應為瞭解，若長男未來由相對人母親照顧，將不會出現陌生感覺，長男目前為兒童階段，生活照顧部份尚需投入心力，故相對人之支持系統為穩定及良好離開聲請人家後仍堅持每兩星期探視長男一次，以及相對人會從老師那裡瞭解長男的成長狀況來看，可見相對人非常在意及關心長男之成長，推估相對人有一定之親職能力兩造之意願、居住硬體及親屬支援系統相當,"親子感情,父母生活,支持系統,意願能力,主要照顧",其經濟狀況一般，加上須負擔家計，未來若單獨撫養長男或較吃緊家人曾兩次搬家，現居所又為不穩定之住處，或對長男適應生活造成困難,"父母生活,支持系統,父母經濟"
52,"201611/臺灣士林地方法院民事/SLDV,105,婚,107,20161118,1.json",39_03_b5238b,a,原告亦能陳述子女身心狀況，兩造健康狀況良好，皆有穩定收入來源，足以妥適照顧子女兩造均具相當親權能力，且在親職時間的分配上兩造皆能配合子女生活作息兩造子女與原告依附關係正向且密切，建議尊重兩造子女之表意權,"父母健康,親子感情,子女意願,父母經濟",,,被告目前與子女同住，為主要照顧者，能清楚描述子女生活作息、身心狀況兩造健康狀況良好，皆有穩定收入來源，足以妥適照顧子女兩造均具相當親權能力，且在親職時間的分配上兩造皆能配合子女生活作息兩造均有具體照護計畫及教育規劃能力，也都有監護意願，足以提供子女良好的教育、生活環境及穩定照顧,"親子感情,父母生活,父母經濟,父母健康,意願能力,主要照顧",,
